{"version":1,"slug":"feat-b","title":"b — gate history lives in the ledger, not in the final verdict","track":"psl","stage":"archive","created_at":"2026-09-04T10:00:00+00:00","updated_at":"2026-09-05T10:00:00+00:00",
 "gates":{"g1":{"required":true,"verdict":"pass"},"g2":{"required":true,"verdict":"pass"},"g3":{"required":true,"verdict":"pass"}},
 "counters":{"card":0,"plan":0,"task":0,"ontology":0,"world":0,"last_fingerprints":{},"fingerprint_repeats":{}},
 "review":{"done":true,"rounds":1},"merge":{"sha":"bbb","merged_at":"2026-09-05T09:00:00+00:00"},"waivers":[],"assumptions":[],"artifacts":{}}
